component,code_location,function_or_context,meaning,stored_in_runtime_item,stored_in_baseline_hybrid_core,shown_in_streamlit,notes
vector_score,vector_search.py:194-209,search,"FAISS inner-product similarity of normalized query embedding and chunk embedding",yes as vector_score via hybrid_search.py:1217,no; baseline_hybrid_core keeps only score_raw/score_normalized,yes,"Original vector result field is score; hybrid_search copies it to vector_score."
metadata_delta,hybrid_search.py:731-888,compute_match_features; compute_hybrid_delta,"Metadata/entity matching delta from disease/species/location/mode and query profile",yes as metadata_delta and legacy kg_bonus via hybrid_search.py:1218-1219,no; only folded into score_raw,yes,"Return key in compute_hybrid_delta is kg_delta for historical naming, but it is metadata_delta in report/runtime item."
kg_score,kg_runtime.py:776-960; hybrid_search.py:1187-1207,score_doc_with_kg,"KG contribution from direct document facts, relation evidence, context evidence and KG penalties",yes as kg_score via hybrid_search.py:1220,no; only folded into score_raw,yes,"Runtime helper also returns kg_direct_match/kg_relation_match/kg_context_match, but baseline_hybrid_core does not persist them."
intent_adjustment,hybrid_search.py:1063-1112; hybrid_search.py:1209-1222,_intent_narrow_final_adjustment,"Narrow intent adjustment for specific query/title patterns",yes as intent_adjustment via hybrid_search.py:1221,no; only folded into score_raw,yes,"A separate late local-aquaculture penalty at hybrid_search.py:1271-1281 modifies final_score directly and is not stored in intent_adjustment."
final_score,hybrid_search.py:1212; hybrid_search.py:1267-1281; run_core_baselines.py:439-455,hybrid_search; hybrid_rows,"Final ranking score used to sort and export hybrid results",yes as final_score,no as column; exported as score_raw in baseline_hybrid_core,yes,"Core formula is vector_score + metadata_delta + kg_score + intent_adjustment; rare late local-aquaculture guardrail may subtract 0.12 directly from final_score."
